{"$schema":"https://json-schema.org/draft/2020-12/schema","type":"object","required":["schema_version","generated_at","source","permissions","groups"],"properties":{"schema_version":{"const":"1.0"},"generated_at":{"type":"string"},"source":{"type":"string"},"permissions":{"type":"object","additionalProperties":{"type":"object","required":["name","level","weight","description","description_zh"],"properties":{"level":{"enum":["normal","dangerous","signature","signatureOrSystem"]},"weight":{"type":"number"}}}},"groups":{"type":"object"}}}
